Begriff,Bestimmung,Richtlinie,Richtlinien_Kuerzel
bewegliche Anlagen,"d. h. eine Kombination von Geräten und gegebenenfalls weiteren Einrichtungen, die beweglich und für den Betrieb an verschiedenen Orten bestimmt ist",Elektromagnetische Verträglichkeit,2014/30/EU
Arbeitsmittel,"Arbeitsmittel sind Werkzeuge, Geräte, Maschinen oder Anlagen, die für die Arbeit verwendet werden, sowie überwachungsbedürftige Anlagen.",Betriebssicherheitsverordnung,2009/104/EG
Verwengung von Arbeitsmitteln ,"Die Verwendung von Arbeitsmitteln umfasst jegliche Tätigkeit mit diesen. Hierzu gehören insbesondere das Montieren und Installieren, Bedienen, An- oder Abschalten oder Einstellen, Gebrauchen, Betreiben, Instandhalten, Reinigen, Prüfen, Umbauen, Erproben, Demontieren, Transportieren und Überwachen.",Betriebssicherheitsverordnung,2009/104/EG
Arbeitgeber,"Arbeitgeber ist, wer nach § 2 Absatz 3 des Arbeitsschutzgesetzes als solcher bestimmt ist. Dem Arbeitgeber steht gleich, 1. wer, ohne Arbeitgeber zu sein, zu gewerblichen oder wirtschaftlichen Zwecken eine überwachungsbedürftige Anlage verwendet, sowie 2. der Auftraggeber und der Zwischenmeister im Sinne des Heimarbeitsgesetzes. ",Betriebssicherheitsverordnung,2009/104/EG
Beschäftigte,"Beschäftigte sind Personen, die nach § 2 Absatz 2 des Arbeitsschutzgesetzes als solche bestimmt sind. Den Beschäftigten stehen folgende Personen gleich, sofern sie Arbeitsmittel verwenden: 1. Schülerinnen und Schüler sowie Studierende, 2. in Heimarbeit Beschäftigte nach § 1 Absatz 1 des Heimarbeitsgesetzes sowie 3. sonstige Personen, insbesondere Personen, die in wissenschaftlichen Einrichtungen tätig sind.",Betriebssicherheitsverordnung,2009/104/EG
Fachkundig,"Fachkundig ist, wer zur Ausübung einer in dieser Verordnung bestimmten Aufgabe über die erforderlichen Fachkenntnisse verfügt. Die Anforderungen an die Fachkunde sind abhängig von der jeweiligen Art der Aufgabe. Zu den Anforderungen zählen eine entsprechende Berufsausbildung, Berufserfahrung oder eine zeitnah ausgeübte entsprechende berufliche Tätigkeit. Die Fachkenntnisse sind durch Teilnahme an Schulungen auf aktuellem Stand zu halten.",Betriebssicherheitsverordnung,2009/104/EG
zur Prüfung befähigte Person,"Zur Prüfung befähigte Person ist eine Person, die durch ihre Berufsausbildung, ihre Berufserfahrung und ihre zeitnahe berufliche Tätigkeit über die erforderlichen Kenntnisse zur Prüfung von Arbeitsmitteln verfügt; soweit hinsichtlich der Prüfung von Arbeitsmitteln in den Anhängen 2 und 3 weitergehende Anforderungen festgelegt sind, sind diese zu erfüllen.",Betriebssicherheitsverordnung,2009/104/EG
Instandhaltung,"Instandhaltung ist die Gesamtheit aller Maßnahmen zur Erhaltung des sicheren Zustands oder der Rückführung in diesen. Instandhaltung umfasst insbesondere Inspektion, Wartung und Instandsetzung.",Betriebssicherheitsverordnung,2009/104/EG
Prüfung,"Prüfung ist die Ermittlung des Istzustands, der Vergleich des Istzustands mit dem Sollzustand sowie die Bewertung der Abweichung des Istzustands vom Sollzustand.",Betriebssicherheitsverordnung,2009/104/EG
Prüfungspflichtig,"Prüfpflichtige Änderung ist jede Maßnahme, durch welche die Sicherheit eines Arbeitsmittels beeinflusst wird. Auch Instandsetzungsarbeiten können solche Maßnahmen sein.",Betriebssicherheitsverordnung,2009/104/EG
Stand der Technik,"Stand der Technik ist der Entwicklungsstand fortschrittlicher Verfahren, Einrichtungen oder Betriebsweisen, der die praktische Eignung einer Maßnahme oder Vorgehensweise zum Schutz der Gesundheit und zur Sicherheit der Beschäftigten oder anderer Personen gesichert erscheinen lässt. Bei der Bestimmung des Stands der Technik sind insbesondere vergleichbare Verfahren, Einrichtungen oder Betriebsweisen heranzuziehen, die mit Erfolg in der Praxis erprobt worden sind.",Betriebssicherheitsverordnung,2009/104/EG
Gefahrenbereich,"Gefahrenbereich ist der Bereich innerhalb oder im Umkreis eines Arbeitsmittels, in dem die Sicherheit oder die Gesundheit von Beschäftigten und anderen Personen durch die Verwendung des Arbeitsmittels gefährdet ist.",Betriebssicherheitsverordnung,2009/104/EG
Errichtung,Errichtung umfasst die Montage und Installation am Verwendungsort.,Betriebssicherheitsverordnung,2009/104/EG
Überwachungsbedürftig,"Überwachungsbedürftige Anlagen sind Anlagen nach § 2 Nummer 30 Satz 1 des Produktsicherheitsgesetzes, soweit sie nach dieser Verordnung in Anhang 2 genannt oder nach § 18 Absatz 1 erlaubnispflichtig sind. Zu den überwachungsbedürftigen Anlagen gehören auch Mess-, Steuer- und Regeleinrichtungen, die dem sicheren Betrieb dieser überwachungsbedürftigen Anlagen dienen.",Betriebssicherheitsverordnung,2009/104/EG
zugelassene Überwachungsstelle,Zugelassene Überwachungsstellen sind die in Anhang 2 Abschnitt 1 genannten Stellen.,Betriebssicherheitsverordnung,2009/104/EG
Andere Personen,"Andere Personen sind Personen, die nicht Beschäftigte oder Gleichgestellte nach Absatz 4 sind und sich im Gefahrenbereich einer überwachungsbedürftigen Anlage innerhalb oder außerhalb eines Betriebsgeländes befinden.",Betriebssicherheitsverordnung,2009/104/EG
